{
  "$schema": "../../../schema/content_validity_dossier.schema.json",
  "dossier_schema_version": "v0.1.0",
  "dossier_id": "test_content_validity_under_review",
  "benchmark_version": "v0.7.1",
  "dossier_status": "in_review",
  "construct_id": "test_cross_domain_bridge",
  "construct_definition": "A focused test construct representing AI-related anxiety responses across a bridge item set before scored promotion.",
  "intended_scored_use": "This under-review artifact records incomplete independent review and must not authorize scored promotion or psychometric promotion review.",
  "target_population": "US adults completing an English-language online ANX-Bench validation survey.",
  "review_protocol_path": "docs/content_validity_protocol.md",
  "item_ids": [
    "test_sleep_ai_news"
  ],
  "domain_facets": [
    {
      "facet_id": "somatic_sleep_disruption",
      "facet_label": "Somatic sleep disruption",
      "facet_definition": "Sleep disruption and difficulty settling after exposure to AI capability information.",
      "required_for_scored_promotion": true,
      "mapped_item_ids": [
        "test_sleep_ai_news"
      ]
    }
  ],
  "reviewer_panel": {
    "reviewer_count": 2,
    "independent_reviewer_count": 2,
    "minimum_independent_reviewers_required": 3,
    "independence_rule": "Reviewers did not draft the items, manage fielding, or hold release authority; ratings are still being collected.",
    "reviewers": [
      {
        "reviewer_id": "reviewer_alpha",
        "expertise_area": "Psychometrics and survey methodology",
        "independent": true,
        "conflict_of_interest_statement": "No item authorship, fielding role, or release authority.",
        "review_completed": true
      },
      {
        "reviewer_id": "reviewer_beta",
        "expertise_area": "AI risk communication and public understanding",
        "independent": true,
        "conflict_of_interest_statement": "No item authorship, fielding role, or release authority.",
        "review_completed": false
      }
    ]
  },
  "item_reviews": [
    {
      "item_id": "test_sleep_ai_news",
      "item_version": "v0.1.0",
      "primary_facet_id": "somatic_sleep_disruption",
      "secondary_facet_ids": [],
      "reviewer_ratings": [
        {
          "reviewer_id": "reviewer_alpha",
          "relevance": 4,
          "clarity": 4,
          "facet_fit": 4,
          "ethical_acceptability": 4,
          "construct_overlap_flag": "none",
          "reading_level_flag": "none",
          "harm_ethics_flag": "none",
          "comments": "Initial rating is acceptable, but the panel is incomplete."
        }
      ],
      "criterion_cvi": {
        "relevance": 1,
        "clarity": 1,
        "facet_fit": 1,
        "ethical_acceptability": 1
      },
      "overall_item_cvi": 1,
      "construct_overlap_flag": "pending_review",
      "reading_level_flag": "pending_review",
      "harm_ethics_flag": "pending_review",
      "required_revision": "pending_review"
    }
  ],
  "scale_level_cvi": {
    "calculation_rule": "Overall item CVI is provisional during review and cannot support scored promotion until three independent reviewers complete ratings.",
    "scale_cvi_average": 1,
    "scale_cvi_universal_agreement": 1,
    "minimum_item_cvi_required": 0.78,
    "minimum_scale_cvi_average_required": 0.9,
    "all_required_facets_covered": false,
    "unresolved_construct_overlap_count": 1,
    "unresolved_reading_level_count": 1,
    "unresolved_harm_ethics_count": 1
  },
  "revision_decisions": [
    {
      "item_id": "test_sleep_ai_news",
      "decision": "pending_review",
      "decision_rationale": "The item remains under content-validity review and has not received full panel resolution.",
      "new_item_version_required": false,
      "resolved_before_scored_promotion": false
    }
  ],
  "promotion_eligibility": {
    "scored_promotion_eligible": false,
    "minimum_independent_reviewers_met": false,
    "all_item_cvi_thresholds_met": true,
    "scale_cvi_threshold_met": true,
    "construct_overlap_resolved": false,
    "reading_level_resolved": false,
    "harm_ethics_resolved": false,
    "eligibility_statement": "The dossier remains under review and cannot support scored promotion until the full independent panel and flag resolution are complete."
  },
  "signoff": {
    "content_validity_decision": "not_reviewed",
    "signed_by": [],
    "signed_date": null,
    "signoff_statement": "No content-validity signoff has been completed because review is still in progress."
  }
}
